sujet,date,statut
Synthwave et imagerie rétro-futuriste spatiale en décoration,2025-10-12T16:11:57.416634,succès_2025-10-13_09:00
Guardians of the Galaxy : quand les couleurs cosmiques deviennent pop,2025-10-12T16:19:41.226944,échec_publication
Culture rave et nébuleuses fluorescentes dans la déco moderne,2025-10-12T16:23:17.575092,échec_publication
Interstellar et la nouvelle représentation des trous noirs,2025-10-12T16:27:12.139896,succès_2025-10-13_09:00
Science-fiction française et son influence sur l'art spatial européen,2025-10-12T16:32:04.935086,succès_2025-10-13_09:00
Mouvement Outrun : l'obsession pour les horizons cosmiques,2025-10-12T16:41:30.372107,succès_2025-10-13_09:00
Steampunk spatial : l'astronomie rétro réinventée en décoration,2025-10-12T16:48:53.656826,succès_2025-10-13_09:00
Influence de Moebius sur l'esthétique désertique-spatiale,2025-10-12T16:53:15.460124,échec_publication
Cosmic Horror : de Lovecraft aux intérieurs gothiques spatiaux,2025-10-12T16:57:11.553343,échec_publication
Mythologies stellaires africaines dans l'art contemporain,2025-10-12T17:00:29.733276,échec_publication
Science-fiction française et son influence sur l'art spatial européen,2025-10-12T17:38:22.666723,succès
Mouvement Outrun : l'obsession pour les horizons cosmiques,2025-10-13T06:58:49.863457,succès
Steampunk spatial : l'astronomie rétro réinventée en décoration,2025-10-13T07:04:34.644217,succès
Influence de Moebius sur l'esthétique désertique-spatiale,2025-10-13T07:09:10.602359,succès
Comment choisir une palette de couleurs neutres pour un Airbnb ?,2025-10-13T07:48:48.775953,succès
Quelles sont les meilleures idées de décoration minimaliste pour location saisonnière ?,2025-10-13T07:53:18.247636,succès
Un beau tableau influence-t-il vraiment la qualité de votre sommeil ?,2025-10-18T13:55:25.885219,succès
Quelles précautions avant d'accrocher une œuvre lourde au-dessus de votre lit ?,2025-10-20T20:02:46.866811,succès
Comment sélectionner un tableau qui plaira aux deux partenaires d'un couple ?,2025-10-23T20:03:09.496443,succès
Faut-il consulter votre conjoint avant d'investir dans une pièce artistique majeure ?,2025-10-27T20:03:01.960569,succès
Quels styles évoquent la sérénité et la sensualité dans une chambre adulte ?,2025-10-30T20:03:55.500098,succès
Les œuvres monochromes créent-elles suffisamment d'intérêt visuel ?,2025-11-03T20:03:09.808757,succès
Quel pourcentage de votre budget déco allouer spécifiquement au tableau mural ?,2025-11-06T20:02:43.989136,succès
Un tableau bien choisi améliore-t-il concrètement votre humeur matinale ?,2025-11-10T20:02:53.672480,succès
Quelles finitions de cadre résistent le mieux au temps dans une chambre ?,2025-11-13T20:02:49.200926,succès
Comment un tableau peut-il différencier votre chambre d'une chambre d'hôtel impersonnelle ?,2025-11-17T20:03:01.170289,succès
Comment adapter votre sélection si vous réaménagez fréquemment ?,2025-11-20T20:02:55.865426,succès
